<?xml version="1.0" encoding="UTF-8"?>
<bdusuarios
xmlns="https://www.l3xfrant3s.com"
xmlns:xsi="http://www.w3.org/2001/XMLSchema-instance"
xsi:schemaLocation="https://www.l3xfrant3s.com bdusuarios.xsd">
    <usuario clave="123" dni="11111111H">
        <nombre>Juan</nombre>
        <email>juan@hotmail.com</email>
        <fechaNac />
    </usuario>
    <usuario clave="321" dni="11233211B">
        <nombre>Yo</nombre>
        <email>yo@elvr.es</email>
        <fechaNac />
    </usuario>
</bdusuarios>